{
  "schema_version": 1,
  "run_set_id": "bring-work-trips-closer-to-home",
  "scenario_id": "Closer01",
  "run_id": "20260710-133516-924e",
  "status": "success",
  "execution_mode": "manual",
  "started_at": "2026-07-10T13:35:16.123132+00:00",
  "finished_at": "2026-07-10T13:36:12.454259+00:00",
  "framework_commit": "bb703ee467a4c696904576d6e9ba99cb6ff91b4a",
  "tdm": {
    "requested_ref": "v10.0.0-beta.1-closer-to-home",
    "resolved_commit": "1fc8a350743446c8f009c031c2839f1e056ebb21",
    "resolved_tag": "v10.0.0-beta.1-closer-to-home",
    "branch": null,
    "detached_head": true,
    "dirty": false
  },
  "control_center": {
    "baseline_file": "_ControlCenter - OY_2027.block",
    "run_set_overrides": {
      "Run_Documentation": 0
    },
    "scenario_overrides": {
      "vizToolDir": "M:\\GitHub\\WF-TDM-Runs\\tdm\\Scenarios\\bring-work-trips-closer-to-home\\.vizTool",
      "RunDescription": "Closer01 - City Area 10% HBW trip redistribution"
    }
  },
  "scenario_folder": "M:\\GitHub\\WF-TDM-Runs\\tdm\\Scenarios\\bring-work-trips-closer-to-home\\Closer01",
  "execution": {},
  "outputs": {
    "inventory_count": 1182,
    "inventory_total_bytes": 39352729618,
    "curated": [
      {
        "relative_path": "0_InputProcessing/SE_File.dbf",
        "size_bytes": 1693167,
        "entry_type": "file",
        "columns": null,
        "sha256": "0bcf0a9e63fe6aa3e91ad303400c29da1b172d909d6da8ed7a02a8992ee77911",
        "repo_path": "M:/GitHub/WF-TDM-Runs/runs/bring-work-trips-closer-to-home/Closer01/20260710-133516-924e/outputs/SE_File.dbf"
      },
      {
        "relative_path": "4_ModeChoice/2_DetailedTripMatrices/_ZoneSummary_TripsByMode.csv",
        "size_bytes": 12135435,
        "entry_type": "file",
        "columns": [
          "Purpose",
          "Period",
          "PA",
          "TAZID",
          "All",
          "Auto",
          "Bike",
          "Moto",
          "NonM",
          "Walk",
          "tTrn"
        ],
        "sha256": "37200b32e84f98d254c6ceabf58ebcafcca767c1586ff1594246693d5e88bbb5",
        "repo_path": "M:/GitHub/WF-TDM-Runs/runs/bring-work-trips-closer-to-home/Closer01/20260710-133516-924e/outputs/_ZoneSummary_TripsByMode_filtered.csv"
      },
      {
        "relative_path": "4_ModeChoice/2_DetailedTripMatrices/HBW_trips_allsegs_pkok.mtx",
        "size_bytes": 11430034,
        "entry_type": "matrix",
        "tabs": [
          "motor",
          "nonmotor"
        ],
        "sha256": "6eacc9461359a8dcab0d3e58a395829eb34219b1e209ed22f4ec3314aba6462f",
        "repo_path": "M:/GitHub/WF-TDM-Runs/runs/bring-work-trips-closer-to-home/Closer01/20260710-133516-924e/outputs/HBW_trips_allsegs_pkok.omx"
      },
      {
        "relative_path": "4_ModeChoice/3_TransitAssign/_transit_brding_summary_route.csv",
        "size_bytes": 26075,
        "entry_type": "file",
        "columns": null,
        "sha256": "297725cc6671494ef083360b834275bb1b479af0e64f570fadc05c96edaa5d10",
        "repo_path": "M:/GitHub/WF-TDM-Runs/runs/bring-work-trips-closer-to-home/Closer01/20260710-133516-924e/outputs/_transit_brding_summary_route.csv"
      },
      {
        "relative_path": "4_ModeChoice/4_Shares/Shares_Summary_long.csv",
        "size_bytes": 2449,
        "entry_type": "file",
        "columns": null,
        "sha256": "8c8627b60d03ff9c24fab59da36e3b9e5891fbc08bc53639b9bbdf0a76ca8952",
        "repo_path": "M:/GitHub/WF-TDM-Runs/runs/bring-work-trips-closer-to-home/Closer01/20260710-133516-924e/outputs/Shares_Summary_long.csv"
      },
      {
        "relative_path": "5_AssignHwy/4_Summaries/Summary_SEGID.csv",
        "size_bytes": 3558880,
        "entry_type": "file",
        "columns": [
          "SEGID",
          "DISTANCE",
          "DIRECTION",
          "FUNCGROUP",
          "SUBAREAID",
          "CO_FIPS",
          "LANES",
          "LANEMILES",
          "FTCLASS",
          "CAP1HL",
          "AM_Vol",
          "MD_Vol",
          "PM_Vol",
          "EV_Vol",
          "DY_Vol",
          "FF_Spd",
          "AM_Spd",
          "MD_Spd",
          "PM_Spd",
          "EV_Spd",
          "DY_Spd",
          "FF_Tme",
          "AM_Tme",
          "MD_Tme",
          "PM_Tme",
          "EV_Tme",
          "DY_Tme",
          "AM_CAP",
          "MD_CAP",
          "PM_CAP",
          "EV_CAP",
          "DY_CAP",
          "AM_VC",
          "MD_VC",
          "PM_VC",
          "EV_VC",
          "MAX_VC",
          "AM_VMT",
          "MD_VMT",
          "PM_VMT",
          "EV_VMT",
          "DY_VMT",
          "AM_VMT_PC",
          "MD_VMT_PC",
          "PM_VMT_PC",
          "EV_VMT_PC",
          "DY_VMT_PC",
          "AM_VMT_LT",
          "MD_VMT_LT",
          "PM_VMT_LT",
          "EV_VMT_LT",
          "DY_VMT_LT",
          "AM_VMT_MD",
          "MD_VMT_MD",
          "PM_VMT_MD",
          "EV_VMT_MD",
          "DY_VMT_MD",
          "AM_VMT_HV",
          "MD_VMT_HV",
          "PM_VMT_HV",
          "EV_VMT_HV",
          "DY_VMT_HV",
          "FF_VHT",
          "AM_VHT",
          "MD_VHT",
          "PM_VHT",
          "EV_VHT",
          "DY_VHT",
          "AM_VHD",
          "MD_VHD",
          "PM_VHD",
          "EV_VHD",
          "DY_VHD"
        ],
        "sha256": "6105281d86b17feb7276b859167592e2e59e850ba9305cfff99bf1bf9cd50842",
        "repo_path": "M:/GitHub/WF-TDM-Runs/runs/bring-work-trips-closer-to-home/Closer01/20260710-133516-924e/outputs/Summary_SEGID_filtered.csv"
      },
      {
        "relative_path": "5_AssignHwy/4_Summaries/TAZ-Based Metrics.csv",
        "size_bytes": 35199365,
        "entry_type": "file",
        "columns": [
          "TAZID",
          "Metric",
          "Purpose",
          "Period",
          "PA",
          "Total"
        ],
        "sha256": "38934e12f8a2257b53ccb1971fab5b26dfd8b68e5599ecd89b9550a1d621f11c",
        "repo_path": "M:/GitHub/WF-TDM-Runs/runs/bring-work-trips-closer-to-home/Closer01/20260710-133516-924e/outputs/TAZ-Based Metrics_filtered.csv"
      },
      {
        "relative_path": "5_AssignHwy/5_FinalNetSkims/Skm_DY.mtx",
        "size_bytes": 37371026,
        "entry_type": "matrix",
        "tabs": [
          "GP_Dist"
        ],
        "sha256": "fdf70ec4cea6c96d71a739241b6d458404839234379b9f628564730744ef711e",
        "repo_path": "M:/GitHub/WF-TDM-Runs/runs/bring-work-trips-closer-to-home/Closer01/20260710-133516-924e/outputs/Skm_DY.omx"
      }
    ]
  },
  "error": null
}
