{
  "schema_version": 1,
  "run_set_id": "non-motorized-2023",
  "scenario_id": "S04",
  "run_id": "20260702-220842-fe00",
  "status": "success",
  "execution_mode": "manual",
  "started_at": "2026-07-02T22:08:42.107505+00:00",
  "finished_at": "2026-07-02T22:08:42.423471+00:00",
  "framework_commit": "5859a7dc6de6016711dc129d099d6f2105a49eef",
  "tdm": {
    "requested_ref": "archive/non-motorized-sensitivity-tests",
    "resolved_commit": "610cb2b7f8de070514668af8eeea7e69e9b732b4",
    "resolved_tag": null,
    "branch": "archive/non-motorized-sensitivity-tests",
    "detached_head": false,
    "dirty": false
  },
  "control_center": {
    "baseline_file": "1ControlCenter - BY_2019.block",
    "run_set_overrides": {
      "Run_Documentation": 0,
      "vizToolDir": "run_sets/non-motorized-2023/.vizTool"
    },
    "scenario_overrides": {
      "RunDescription": "S04 - localized EMP x2",
      "WFRC_SEFile": "M:\\GitHub\\WF-TDM-Runs\\run_sets\\non-motorized-2023\\inputs\\SE_S04.csv",
      "MAG_SEFile": "M:\\GitHub\\WF-TDM-Runs\\run_sets\\non-motorized-2023\\inputs\\SE_S04.csv"
    }
  },
  "scenario_folder": "M:\\GitHub\\WF-TDM-Runs\\tdm\\Scenarios\\non-motorized-2023\\BY_2019_SensitivityTest_04",
  "execution": {},
  "outputs": {
    "inventory_count": 1095,
    "inventory_total_bytes": 27273487530,
    "curated": [
      {
        "relative_path": "4_ModeChoice/2_DetailedTripMatrices/BY_SensitivityTest_04_2019_ZoneSummary_TripsByMode.csv",
        "size_bytes": 39280455,
        "sha256": "621e3b49dd7e446af50ffe752540968d62116f36d43659b9c4d65e92d80ff7db",
        "repo_path": "M:/GitHub/WF-TDM-Runs/runs/non-motorized-2023/S04/20260702-220842-fe00/outputs/BY_SensitivityTest_04_2019_ZoneSummary_TripsByMode.csv"
      }
    ],
    "retired": true,
    "retired_at": "2026-07-03T11:52:46.324101+00:00"
  },
  "error": null
}
