{
  "schema_version": 1,
  "run_set_id": "v10.0-beta.2",
  "scenario_id": "v10.0-beta.2-2055",
  "run_id": "20260918-233218-0909",
  "status": "success",
  "execution_mode": "cli",
  "started_at": "2026-09-18T23:32:18.988427+00:00",
  "finished_at": "2026-09-19T07:25:52.230602+00:00",
  "framework_commit": "70b340b11aa5cfe9cc31740d00b74caa686c47f8",
  "tdm": {
    "requested_ref": "v10.0.0-beta.2",
    "resolved_commit": "2772f0b1e3d4b2efb2be45cf16a56b78d1ae66db",
    "resolved_tag": "v10.0.0-beta.2",
    "branch": null,
    "detached_head": true,
    "dirty": false
  },
  "control_center": {
    "baseline_file": "_ControlCenter - Needs_2055.block",
    "run_set_overrides": {},
    "scenario_overrides": {
      "UserName": "Bill Hereth",
      "UserCompany": "WFRC",
      "RunDescription": "Needs 2055 Run for v10.0-beta.2",
      "runId": "_",
      "Run_vizTool": 1,
      "vizToolDir": "E:\\GitHub\\WF-TDM-Runs\\runs\\v10.0-beta.2\\.vizTool"
    },
    "rendered_path": "E:\\GitHub\\WF-TDM-Runs\\tdm\\Scenarios\\v10.0-beta.2\\v10.0-beta.2-2055\\_ControlCenter.block",
    "driver_script": "Scenarios/_default/__HailMary_1Subfolder_resumable.s"
  },
  "scenario_folder": "E:\\GitHub\\WF-TDM-Runs\\tdm\\Scenarios\\v10.0-beta.2\\v10.0-beta.2-2055",
  "execution": {
    "command": [
      "cmd.exe",
      "/c",
      "E:\\GitHub\\WF-TDM-Runs\\bin\\RunModel.bat",
      "E:\\GitHub\\WF-TDM-Runs\\tdm\\Scenarios\\v10.0-beta.2\\v10.0-beta.2-2055\\_ControlCenter.block",
      "E:\\GitHub\\WF-TDM-Runs\\tdm\\Scenarios\\v10.0-beta.2\\v10.0-beta.2-2055"
    ],
    "voyager_exe": "C:\\Program Files\\Bentley\\OpenPaths\\CUBE 25.01.01\\Voyager\\Voyager.exe",
    "exit_code": 1,
    "log_path": "E:\\GitHub\\WF-TDM-Runs\\tdm\\Scenarios\\v10.0-beta.2\\v10.0-beta.2-2055\\logs\\orchestrator_invocation.log",
    "status_source": "model_log",
    "model_log": {
      "outcome": "success",
      "crashed_step": null,
      "started_at": "2026-09-18,  17:32:22",
      "finished_at": "2026-09-19,  01:25:52",
      "run_time": "007:53:30",
      "exit_code_mismatch": true
    }
  },
  "outputs": {
    "inventory_count": 1123,
    "inventory_total_bytes": 43100662855,
    "curated": [
      {
        "relative_path": "5_AssignHwy/4_Summaries/_Summary_SEGID.csv",
        "size_bytes": 4013504,
        "entry_type": "datafile",
        "columns": [
          "SEGID",
          "DISTANCE",
          "DIRECTION",
          "FUNCGROUP",
          "SUBAREAID",
          "CO_FIPS",
          "LANES",
          "LANEMILES",
          "FTCLASS",
          "CAP1HL",
          "AM_Vol",
          "MD_Vol",
          "PM_Vol",
          "EV_Vol",
          "DY_Vol",
          "FF_Spd",
          "AM_Spd",
          "MD_Spd",
          "PM_Spd",
          "EV_Spd",
          "DY_Spd",
          "FF_Tme",
          "AM_Tme",
          "MD_Tme",
          "PM_Tme",
          "EV_Tme",
          "AM_CAP",
          "MD_CAP",
          "PM_CAP",
          "EV_CAP",
          "DY_CAP",
          "AM_VC",
          "MD_VC",
          "PM_VC",
          "EV_VC",
          "MAX_VC",
          "AM_VMT",
          "MD_VMT",
          "PM_VMT",
          "EV_VMT",
          "DY_VMT",
          "AM_VMT_PC",
          "MD_VMT_PC",
          "PM_VMT_PC",
          "EV_VMT_PC",
          "DY_VMT_PC",
          "AM_VMT_LT",
          "MD_VMT_LT",
          "PM_VMT_LT",
          "EV_VMT_LT",
          "DY_VMT_LT",
          "AM_VMT_MD",
          "MD_VMT_MD",
          "PM_VMT_MD",
          "EV_VMT_MD",
          "DY_VMT_MD",
          "AM_VMT_HV",
          "MD_VMT_HV",
          "PM_VMT_HV",
          "EV_VMT_HV",
          "DY_VMT_HV",
          "FF_VHT",
          "AM_VHT",
          "MD_VHT",
          "PM_VHT",
          "EV_VHT",
          "DY_VHT",
          "AM_VHD",
          "MD_VHD",
          "PM_VHD",
          "EV_VHD",
          "DY_VHD"
        ],
        "sha256": "53407e9c8289c877461624f58e855b01278c350be04e6888445af58a33286704",
        "repo_path": "runs/v10.0-beta.2/v10.0-beta.2-2055/outputs/_Summary_SEGID_filtered.csv",
        "committed": true
      }
    ]
  },
  "error": null
}
