{
  "schema_version": 1,
  "run_set_id": "bring-work-trips-closer-to-home",
  "scenario_id": "Closer07",
  "run_id": "20260711-071720-0227",
  "status": "success",
  "execution_mode": "manual",
  "started_at": "2026-07-11T07:17:20.891892+00:00",
  "finished_at": "2026-07-11T07:19:45.910068+00:00",
  "framework_commit": "964b9911d99e56f2e19a001f6ec1de55ce6f49ea",
  "tdm": {
    "requested_ref": "v10.0.0-beta.1-closer-to-home",
    "resolved_commit": "1fc8a350743446c8f009c031c2839f1e056ebb21",
    "resolved_tag": "v10.0.0-beta.1-closer-to-home",
    "branch": null,
    "detached_head": true,
    "dirty": false
  },
  "control_center": {
    "baseline_file": "_ControlCenter - OY_2027.block",
    "run_set_overrides": {
      "Run_Documentation": 0
    },
    "scenario_overrides": {
      "vizToolDir": "M:\\GitHub\\WF-TDM-Runs\\tdm\\Scenarios\\bring-work-trips-closer-to-home\\.vizTool",
      "RunDescription": "Closer07 - City Area 25% HBW trip redistribution"
    }
  },
  "scenario_folder": "M:\\GitHub\\WF-TDM-Runs\\tdm\\Scenarios\\bring-work-trips-closer-to-home\\Closer07",
  "execution": {},
  "outputs": {
    "inventory_count": 1212,
    "inventory_total_bytes": 39323175845,
    "curated": [
      {
        "relative_path": "0_InputProcessing/SE_File.dbf",
        "size_bytes": 1693167,
        "entry_type": "datafile",
        "columns": null,
        "sha256": "0bcf0a9e63fe6aa3e91ad303400c29da1b172d909d6da8ed7a02a8992ee77911",
        "repo_path": "runs/bring-work-trips-closer-to-home/Closer07/20260711-071720-0227/outputs/SE_File.dbf"
      },
      {
        "relative_path": "4_ModeChoice/2_DetailedTripMatrices/_ZoneSummary_TripsByMode.csv",
        "size_bytes": 12135435,
        "entry_type": "datafile",
        "columns": [
          "Purpose",
          "Period",
          "PA",
          "TAZID",
          "All",
          "Auto",
          "Bike",
          "Moto",
          "NonM",
          "Walk",
          "tTrn"
        ],
        "sha256": "104c0a12f743cd65305092859498e6b6751f6cae7bb2491b87382a442b4df6aa",
        "repo_path": "runs/bring-work-trips-closer-to-home/Closer07/20260711-071720-0227/outputs/_ZoneSummary_TripsByMode_filtered.csv"
      },
      {
        "relative_path": "4_ModeChoice/2_DetailedTripMatrices/HBW_trips_allsegs_Ok.mtx",
        "size_bytes": 10430136,
        "entry_type": "matrix",
        "tabs": [
          "motor",
          "nonmotor"
        ],
        "format": "omx",
        "sha256": "830582b64dd0f364fcee3df07fcb16801373b416fb4c5b15e5d9ddf16452062e",
        "repo_path": "runs/bring-work-trips-closer-to-home/Closer07/20260711-071720-0227/outputs/HBW_trips_allsegs_Ok.omx"
      },
      {
        "relative_path": "4_ModeChoice/2_DetailedTripMatrices/HBW_trips_allsegs_Pk.mtx",
        "size_bytes": 10696182,
        "entry_type": "matrix",
        "tabs": [
          "motor",
          "nonmotor"
        ],
        "format": "omx",
        "sha256": "9ff6bc5061fdb9ca8bc63cacdd4046ee1c7f5aad72a4d2f26331607b4cef9238",
        "repo_path": "runs/bring-work-trips-closer-to-home/Closer07/20260711-071720-0227/outputs/HBW_trips_allsegs_Pk.omx"
      },
      {
        "relative_path": "4_ModeChoice/3_TransitAssign/_transit_brding_summary_route.csv",
        "size_bytes": 26075,
        "entry_type": "datafile",
        "columns": null,
        "sha256": "5bb677a4996b328a2364516bb17987bdcf835ca46065c8d192ba7c8c87880ad2",
        "repo_path": "runs/bring-work-trips-closer-to-home/Closer07/20260711-071720-0227/outputs/_transit_brding_summary_route.csv"
      },
      {
        "relative_path": "4_ModeChoice/4_Shares/Shares_Summary_long.csv",
        "size_bytes": 2450,
        "entry_type": "datafile",
        "columns": null,
        "sha256": "f577eb2130a0cd6ae40321b5917e18fea7ad4cfcd57046103dee579e4369eba5",
        "repo_path": "runs/bring-work-trips-closer-to-home/Closer07/20260711-071720-0227/outputs/Shares_Summary_long.csv"
      },
      {
        "relative_path": "5_AssignHwy/4_Summaries/Summary_SEGID.csv",
        "size_bytes": 3558880,
        "entry_type": "datafile",
        "columns": [
          "SEGID",
          "DISTANCE",
          "DIRECTION",
          "FUNCGROUP",
          "SUBAREAID",
          "CO_FIPS",
          "LANES",
          "LANEMILES",
          "FTCLASS",
          "CAP1HL",
          "AM_Vol",
          "MD_Vol",
          "PM_Vol",
          "EV_Vol",
          "DY_Vol",
          "FF_Spd",
          "AM_Spd",
          "MD_Spd",
          "PM_Spd",
          "EV_Spd",
          "DY_Spd",
          "FF_Tme",
          "AM_Tme",
          "MD_Tme",
          "PM_Tme",
          "EV_Tme",
          "DY_Tme",
          "AM_CAP",
          "MD_CAP",
          "PM_CAP",
          "EV_CAP",
          "DY_CAP",
          "AM_VC",
          "MD_VC",
          "PM_VC",
          "EV_VC",
          "MAX_VC",
          "AM_VMT",
          "MD_VMT",
          "PM_VMT",
          "EV_VMT",
          "DY_VMT",
          "AM_VMT_PC",
          "MD_VMT_PC",
          "PM_VMT_PC",
          "EV_VMT_PC",
          "DY_VMT_PC",
          "AM_VMT_LT",
          "MD_VMT_LT",
          "PM_VMT_LT",
          "EV_VMT_LT",
          "DY_VMT_LT",
          "AM_VMT_MD",
          "MD_VMT_MD",
          "PM_VMT_MD",
          "EV_VMT_MD",
          "DY_VMT_MD",
          "AM_VMT_HV",
          "MD_VMT_HV",
          "PM_VMT_HV",
          "EV_VMT_HV",
          "DY_VMT_HV",
          "FF_VHT",
          "AM_VHT",
          "MD_VHT",
          "PM_VHT",
          "EV_VHT",
          "DY_VHT",
          "AM_VHD",
          "MD_VHD",
          "PM_VHD",
          "EV_VHD",
          "DY_VHD"
        ],
        "sha256": "308bfcb62302251e8383eb8b680d19ed716c9b7ebcdedcfb57e36589bf06b231",
        "repo_path": "runs/bring-work-trips-closer-to-home/Closer07/20260711-071720-0227/outputs/Summary_SEGID_filtered.csv"
      },
      {
        "relative_path": "5_AssignHwy/4_Summaries/TAZ-Based Metrics.csv",
        "size_bytes": 35162221,
        "entry_type": "datafile",
        "columns": [
          "TAZID",
          "Metric",
          "Purpose",
          "Period",
          "PA",
          "Total"
        ],
        "sha256": "aa6d19e74ef3cf3536026e287b61b11e0b43e8991141b581f4329b9609a37a0b",
        "repo_path": "runs/bring-work-trips-closer-to-home/Closer07/20260711-071720-0227/outputs/TAZ-Based Metrics_filtered.csv"
      },
      {
        "relative_path": "5_AssignHwy/5_FinalNetSkims/Skm_AM.mtx",
        "size_bytes": 37377581,
        "entry_type": "matrix",
        "tabs": [
          "GP_Dist"
        ],
        "format": "omx",
        "sha256": "a15e545b5dc8133c2ecfe652cff671a4212d687875c79b07231054f54d1e33dc",
        "repo_path": "runs/bring-work-trips-closer-to-home/Closer07/20260711-071720-0227/outputs/Skm_AM.omx"
      },
      {
        "relative_path": "5_AssignHwy/5_FinalNetSkims/Skm_EV.mtx",
        "size_bytes": 37352943,
        "entry_type": "matrix",
        "tabs": [
          "GP_Dist"
        ],
        "format": "omx",
        "sha256": "f6bb320f331eca54b238529ed3aaee7c128e5c837c997e185f8f98a75db8cb89",
        "repo_path": "runs/bring-work-trips-closer-to-home/Closer07/20260711-071720-0227/outputs/Skm_EV.omx"
      },
      {
        "relative_path": "5_AssignHwy/5_FinalNetSkims/Skm_MD.mtx",
        "size_bytes": 37388218,
        "entry_type": "matrix",
        "tabs": [
          "GP_Dist"
        ],
        "format": "omx",
        "sha256": "04bdfaf33779e2c1418b50b72b925a6f9ef2e15028ee5452334daed1a33400e6",
        "repo_path": "runs/bring-work-trips-closer-to-home/Closer07/20260711-071720-0227/outputs/Skm_MD.omx"
      },
      {
        "relative_path": "5_AssignHwy/5_FinalNetSkims/Skm_PM.mtx",
        "size_bytes": 37466538,
        "entry_type": "matrix",
        "tabs": [
          "GP_Dist"
        ],
        "format": "omx",
        "sha256": "83d2e702ed75c6095e6df6c0cda72721fd5ab8d5a92efd30cc8d95e8622e5912",
        "repo_path": "runs/bring-work-trips-closer-to-home/Closer07/20260711-071720-0227/outputs/Skm_PM.omx"
      }
    ]
  },
  "error": null
}
