{
  "schema_version": 1,
  "run_set_id": "non-motorized-2023",
  "scenario_id": "S08",
  "run_id": "20260702-220843-8c51",
  "status": "success",
  "execution_mode": "manual",
  "started_at": "2026-07-02T22:08:43.417764+00:00",
  "finished_at": "2026-07-02T22:08:43.743933+00:00",
  "framework_commit": "5859a7dc6de6016711dc129d099d6f2105a49eef",
  "tdm": {
    "requested_ref": "archive/non-motorized-sensitivity-tests",
    "resolved_commit": "610cb2b7f8de070514668af8eeea7e69e9b732b4",
    "resolved_tag": null,
    "branch": "archive/non-motorized-sensitivity-tests",
    "detached_head": false,
    "dirty": false
  },
  "control_center": {
    "baseline_file": "1ControlCenter - BY_2019.block",
    "run_set_overrides": {
      "Run_Documentation": 0,
      "vizToolDir": "run_sets/non-motorized-2023/.vizTool"
    },
    "scenario_overrides": {
      "RunDescription": "S08 - localized HH x4 + EMP x4 (smldst+taz)",
      "WFRC_SEFile": "M:\\GitHub\\WF-TDM-Runs\\run_sets\\non-motorized-2023\\inputs\\SE_S08.csv",
      "MAG_SEFile": "M:\\GitHub\\WF-TDM-Runs\\run_sets\\non-motorized-2023\\inputs\\SE_S08.csv"
    }
  },
  "scenario_folder": "M:\\GitHub\\WF-TDM-Runs\\tdm\\Scenarios\\non-motorized-2023\\BY_2019_SensitivityTest_08",
  "execution": {},
  "outputs": {
    "inventory_count": 1054,
    "inventory_total_bytes": 23826292519,
    "curated": [
      {
        "relative_path": "4_ModeChoice/2_DetailedTripMatrices/BY_SensitivityTest_08_2019_ZoneSummary_TripsByMode.csv",
        "size_bytes": 39280455,
        "sha256": "96dfffb9e55ae105bfd20a1043a869c3b8a7e966c47880a75f8115ab441b676d",
        "repo_path": "runs/non-motorized-2023/S08/outputs/BY_SensitivityTest_08_2019_ZoneSummary_TripsByMode.csv"
      }
    ],
    "retired": true,
    "retired_at": "2026-07-03T11:52:46.324101+00:00"
  },
  "error": null
}
