{
  "schema_version": 1,
  "run_set_id": "bring-work-trips-closer-to-home",
  "scenario_id": "Closer03",
  "run_id": "20260710-121947-7abe",
  "status": "success",
  "execution_mode": "manual",
  "started_at": "2026-07-10T12:19:47.525146+00:00",
  "finished_at": "2026-07-10T12:19:58.726074+00:00",
  "framework_commit": "bb703ee467a4c696904576d6e9ba99cb6ff91b4a",
  "tdm": {
    "requested_ref": "v10.0.0-beta.1-closer-to-home",
    "resolved_commit": "1fc8a350743446c8f009c031c2839f1e056ebb21",
    "resolved_tag": "v10.0.0-beta.1-closer-to-home",
    "branch": null,
    "detached_head": true,
    "dirty": false
  },
  "control_center": {
    "baseline_file": "_ControlCenter - OY_2027.block",
    "run_set_overrides": {
      "Run_Documentation": 0
    },
    "scenario_overrides": {
      "vizToolDir": "M:\\GitHub\\WF-TDM-Runs\\tdm\\Scenarios\\bring-work-trips-closer-to-home\\.vizTool",
      "RunDescription": "Closer03 - Workshop Area 10% HBW trip redistribution"
    }
  },
  "scenario_folder": "M:\\GitHub\\WF-TDM-Runs\\tdm\\Scenarios\\bring-work-trips-closer-to-home\\Closer03",
  "execution": {},
  "outputs": {
    "inventory_count": 1182,
    "inventory_total_bytes": 39362884999,
    "curated": [
      {
        "relative_path": "0_InputProcessing/SE_File.dbf",
        "size_bytes": 1693167,
        "columns": null,
        "sha256": "0bcf0a9e63fe6aa3e91ad303400c29da1b172d909d6da8ed7a02a8992ee77911",
        "repo_path": "M:/GitHub/WF-TDM-Runs/runs/bring-work-trips-closer-to-home/Closer03/20260710-121947-7abe/outputs/SE_File.dbf"
      },
      {
        "relative_path": "4_ModeChoice/2_DetailedTripMatrices/_ZoneSummary_TripsByMode.csv",
        "size_bytes": 12135435,
        "columns": [
          "Purpose",
          "Period",
          "PA",
          "TAZID",
          "All",
          "Auto",
          "Bike",
          "Moto",
          "NonM",
          "Walk",
          "tTrn"
        ],
        "sha256": "fbf83696e57c2333262dffbb5c04a2855b1ef09a06afd301212bb516f6ab1897",
        "repo_path": "M:/GitHub/WF-TDM-Runs/runs/bring-work-trips-closer-to-home/Closer03/20260710-121947-7abe/outputs/_ZoneSummary_TripsByMode_filtered.csv"
      },
      {
        "relative_path": "4_ModeChoice/3_TransitAssign/_transit_brding_summary_route.csv",
        "size_bytes": 26075,
        "columns": null,
        "sha256": "7be6266ebef88d8612e50c9d9c35aba0af253c02f7933a3335aa42dbc6bae6c5",
        "repo_path": "M:/GitHub/WF-TDM-Runs/runs/bring-work-trips-closer-to-home/Closer03/20260710-121947-7abe/outputs/_transit_brding_summary_route.csv"
      },
      {
        "relative_path": "4_ModeChoice/4_Shares/Shares_Summary_long.csv",
        "size_bytes": 2449,
        "columns": null,
        "sha256": "dc09f82269d2fb2e9fd5d7601f84f8e853c9495649b96d070da2c530a3e5b73e",
        "repo_path": "M:/GitHub/WF-TDM-Runs/runs/bring-work-trips-closer-to-home/Closer03/20260710-121947-7abe/outputs/Shares_Summary_long.csv"
      },
      {
        "relative_path": "5_AssignHwy/4_Summaries/Summary_SEGID.csv",
        "size_bytes": 3558880,
        "columns": [
          "SEGID",
          "DISTANCE",
          "DIRECTION",
          "FUNCGROUP",
          "SUBAREAID",
          "CO_FIPS",
          "LANES",
          "LANEMILES",
          "FTCLASS",
          "CAP1HL",
          "AM_Vol",
          "MD_Vol",
          "PM_Vol",
          "EV_Vol",
          "DY_Vol",
          "FF_Spd",
          "AM_Spd",
          "MD_Spd",
          "PM_Spd",
          "EV_Spd",
          "DY_Spd",
          "FF_Tme",
          "AM_Tme",
          "MD_Tme",
          "PM_Tme",
          "EV_Tme",
          "DY_Tme",
          "AM_CAP",
          "MD_CAP",
          "PM_CAP",
          "EV_CAP",
          "DY_CAP",
          "AM_VC",
          "MD_VC",
          "PM_VC",
          "EV_VC",
          "MAX_VC",
          "AM_VMT",
          "MD_VMT",
          "PM_VMT",
          "EV_VMT",
          "DY_VMT",
          "AM_VMT_PC",
          "MD_VMT_PC",
          "PM_VMT_PC",
          "EV_VMT_PC",
          "DY_VMT_PC",
          "AM_VMT_LT",
          "MD_VMT_LT",
          "PM_VMT_LT",
          "EV_VMT_LT",
          "DY_VMT_LT",
          "AM_VMT_MD",
          "MD_VMT_MD",
          "PM_VMT_MD",
          "EV_VMT_MD",
          "DY_VMT_MD",
          "AM_VMT_HV",
          "MD_VMT_HV",
          "PM_VMT_HV",
          "EV_VMT_HV",
          "DY_VMT_HV",
          "FF_VHT",
          "AM_VHT",
          "MD_VHT",
          "PM_VHT",
          "EV_VHT",
          "DY_VHT",
          "AM_VHD",
          "MD_VHD",
          "PM_VHD",
          "EV_VHD",
          "DY_VHD"
        ],
        "sha256": "3a40bac9013c024100c7fe824144c972f1f919a6cb4cc69378da7216520de2ad",
        "repo_path": "M:/GitHub/WF-TDM-Runs/runs/bring-work-trips-closer-to-home/Closer03/20260710-121947-7abe/outputs/Summary_SEGID_filtered.csv"
      },
      {
        "relative_path": "5_AssignHwy/4_Summaries/TAZ-Based Metrics.csv",
        "size_bytes": 35224114,
        "columns": [
          "TAZID",
          "Metric",
          "Purpose",
          "Period",
          "PA",
          "Total"
        ],
        "sha256": "8d557ea6cf48588b92c6b4c86506cd4e86f3affc926a2171c908fc618744a618",
        "repo_path": "M:/GitHub/WF-TDM-Runs/runs/bring-work-trips-closer-to-home/Closer03/20260710-121947-7abe/outputs/TAZ-Based Metrics_filtered.csv"
      }
    ]
  },
  "error": null
}
