{
  "schema_version": 1,
  "run_set_id": "shorten-lengthen-all-work-trips",
  "scenario_id": "ShiftM05",
  "run_id": "20260812-200959-333c",
  "status": "failed",
  "execution_mode": "cli",
  "started_at": "2026-08-12T20:09:59.521277+00:00",
  "finished_at": "2026-08-12T21:39:44.349829+00:00",
  "framework_commit": "f5ed1c8194e89b7d403ee7f0ebb533b8f5139e45",
  "tdm": {
    "requested_ref": "v10.0.0-beta.1-closer-to-home",
    "resolved_commit": "1fc8a350743446c8f009c031c2839f1e056ebb21",
    "resolved_tag": "v10.0.0-beta.1-closer-to-home",
    "branch": null,
    "detached_head": true,
    "dirty": false
  },
  "control_center": {
    "baseline_file": "_ControlCenter - OY_2027.block",
    "run_set_overrides": {
      "Run_Documentation": 0
    },
    "scenario_overrides": {
      "vizToolDir": "M:\\GitHub\\WF-TDM-Runs\\tdm\\Scenarios\\shorten-lengthen-all-work-trips\\.vizTool",
      "RunDescription": "ShiftM05 - -5% region-wide HBW trip-length shift"
    },
    "rendered_path": "C:\\Users\\bhereth\\Documents\\GitHub\\WF-TDM-Runs\\tdm\\Scenarios\\shorten-lengthen-all-work-trips\\ShiftM05\\_ControlCenter.block",
    "driver_script": "hail-mary/__HailMary_1Subfolder_shiftlength.s"
  },
  "scenario_folder": "C:\\Users\\bhereth\\Documents\\GitHub\\WF-TDM-Runs\\tdm\\Scenarios\\shorten-lengthen-all-work-trips\\ShiftM05",
  "execution": {
    "command": [
      "cmd.exe",
      "/c",
      "C:\\Users\\bhereth\\Documents\\GitHub\\WF-TDM-Runs\\bin\\RunModel.bat",
      "C:\\Users\\bhereth\\Documents\\GitHub\\WF-TDM-Runs\\tdm\\Scenarios\\shorten-lengthen-all-work-trips\\ShiftM05\\_ControlCenter.block",
      "C:\\Users\\bhereth\\Documents\\GitHub\\WF-TDM-Runs\\tdm\\Scenarios\\shorten-lengthen-all-work-trips\\ShiftM05"
    ],
    "exit_code": 1,
    "log_path": "C:\\Users\\bhereth\\Documents\\GitHub\\WF-TDM-Runs\\tdm\\Scenarios\\shorten-lengthen-all-work-trips\\ShiftM05\\logs\\orchestrator_invocation.log",
    "status_source": "model_log",
    "model_log": {
      "outcome": "crashed",
      "crashed_step": "?      4.00         ?         ?         ?",
      "started_at": "2026-08-12,  14:10:00",
      "finished_at": "2026-08-12,  15:39:38",
      "run_time": "001:29:38",
      "exit_code_mismatch": false
    }
  },
  "outputs": {
    "inventory_count": 1152,
    "inventory_total_bytes": 39821151799,
    "curated": []
  },
  "error": "Model crashed during ?      4.00         ?         ?         ? (see C:\\Users\\bhereth\\Documents\\GitHub\\WF-TDM-Runs\\tdm\\Scenarios\\shorten-lengthen-all-work-trips\\ShiftM05\\_Log\\_RunTime.txt). Voyager exit code: 1. Output curation failed: CONVERTMAT did not produce C:\\Users\\bhereth\\Documents\\GitHub\\WF-TDM-Runs\\runs\\shorten-lengthen-all-work-trips\\ShiftM05\\20260812-200959-333c\\outputs\\_full_HBW_trips_allsegs_Ok.omx -- check C:\\Users\\bhereth\\AppData\\Local\\Temp\\convertmat_7qfnmrnm\\_convert_in_HBW_trips_allsegs_Ok.bat output"
}
