{
  "schema_version": 1,
  "run_set_id": "shorten-lengthen-all-work-trips",
  "scenario_id": "Shift00",
  "run_id": "20260812-044057-56f4",
  "status": "success",
  "execution_mode": "manual",
  "started_at": "2026-08-12T04:40:57.004435+00:00",
  "finished_at": "2026-08-12T04:44:12.437995+00:00",
  "framework_commit": "26ccec6dfe4cb9dfa1195e514e761d0e30700b9f",
  "tdm": {
    "requested_ref": "v10.0.0-beta.1-closer-to-home",
    "resolved_commit": "1fc8a350743446c8f009c031c2839f1e056ebb21",
    "resolved_tag": "v10.0.0-beta.1-closer-to-home",
    "branch": null,
    "detached_head": true,
    "dirty": false
  },
  "control_center": {
    "baseline_file": "_ControlCenter - OY_2027.block",
    "run_set_overrides": {
      "Run_Documentation": 0
    },
    "scenario_overrides": {}
  },
  "scenario_folder": "M:\\GitHub\\WF-TDM-Runs\\tdm\\Scenarios\\bring-work-trips-closer-to-home\\Closer00",
  "execution": {},
  "outputs": {
    "inventory_count": 1123,
    "inventory_total_bytes": 37180992350,
    "curated": [
      {
        "relative_path": "0_InputProcessing/SE_File.dbf",
        "size_bytes": 1693167,
        "entry_type": "datafile",
        "columns": null,
        "sha256": "0bcf0a9e63fe6aa3e91ad303400c29da1b172d909d6da8ed7a02a8992ee77911",
        "repo_path": "runs/shorten-lengthen-all-work-trips/Shift00/20260812-044057-56f4/outputs/SE_File.dbf"
      },
      {
        "relative_path": "4_ModeChoice/2_DetailedTripMatrices/_ZoneSummary_TripsByMode.csv",
        "size_bytes": 12135435,
        "entry_type": "datafile",
        "columns": [
          "Purpose",
          "Period",
          "PA",
          "TAZID",
          "All",
          "Auto",
          "Bike",
          "Moto",
          "NonM",
          "Walk",
          "tTrn"
        ],
        "sha256": "d851c25c5aab9cee36d24233a16857965597795d028c53da82d54db5429a4dd8",
        "repo_path": "runs/shorten-lengthen-all-work-trips/Shift00/20260812-044057-56f4/outputs/_ZoneSummary_TripsByMode_filtered.csv"
      },
      {
        "relative_path": "4_ModeChoice/2_DetailedTripMatrices/HBW_trips_allsegs_Ok.mtx",
        "size_bytes": 10685178,
        "entry_type": "matrix",
        "tabs": [
          "motor",
          "nonmotor"
        ],
        "format": "omx",
        "sha256": "d0a9725a143a7a20327038649eb6d5042a63ce031619aa8d713f907c39b06d8e",
        "repo_path": "runs/shorten-lengthen-all-work-trips/Shift00/20260812-044057-56f4/outputs/HBW_trips_allsegs_Ok.omx"
      },
      {
        "relative_path": "4_ModeChoice/2_DetailedTripMatrices/HBW_trips_allsegs_Pk.mtx",
        "size_bytes": 11923073,
        "entry_type": "matrix",
        "tabs": [
          "motor",
          "nonmotor"
        ],
        "format": "omx",
        "sha256": "8bf8090821fbe5ccb63032448bf61fa153871c912e3a5e1d61ce7814f77ddcdc",
        "repo_path": "runs/shorten-lengthen-all-work-trips/Shift00/20260812-044057-56f4/outputs/HBW_trips_allsegs_Pk.omx"
      },
      {
        "relative_path": "4_ModeChoice/3_TransitAssign/_transit_brding_summary_route.csv",
        "size_bytes": 26075,
        "entry_type": "datafile",
        "columns": null,
        "sha256": "d48ad4ef187fc6ca22cf62968b1a6a8562e907850ac6086352071cf7c8989b53",
        "repo_path": "runs/shorten-lengthen-all-work-trips/Shift00/20260812-044057-56f4/outputs/_transit_brding_summary_route.csv"
      },
      {
        "relative_path": "4_ModeChoice/4_Shares/Shares_Summary_long.csv",
        "size_bytes": 2450,
        "entry_type": "datafile",
        "columns": null,
        "sha256": "0b56dcd6ce16cb5e9ea7bd96bfb9bde8dd89d0122f75232d7d80aecda61d1a4f",
        "repo_path": "runs/shorten-lengthen-all-work-trips/Shift00/20260812-044057-56f4/outputs/Shares_Summary_long.csv"
      },
      {
        "relative_path": "5_AssignHwy/4_Summaries/Summary_SEGID.csv",
        "size_bytes": 3509626,
        "entry_type": "datafile",
        "columns": [
          "SEGID",
          "DISTANCE",
          "DIRECTION",
          "FUNCGROUP",
          "SUBAREAID",
          "CO_FIPS",
          "LANES",
          "LANEMILES",
          "FTCLASS",
          "CAP1HL",
          "AM_Vol",
          "MD_Vol",
          "PM_Vol",
          "EV_Vol",
          "DY_Vol",
          "FF_Spd",
          "AM_Spd",
          "MD_Spd",
          "PM_Spd",
          "EV_Spd",
          "DY_Spd",
          "FF_Tme",
          "AM_Tme",
          "MD_Tme",
          "PM_Tme",
          "EV_Tme",
          "AM_CAP",
          "MD_CAP",
          "PM_CAP",
          "EV_CAP",
          "DY_CAP",
          "AM_VC",
          "MD_VC",
          "PM_VC",
          "EV_VC",
          "MAX_VC",
          "AM_VMT",
          "MD_VMT",
          "PM_VMT",
          "EV_VMT",
          "DY_VMT",
          "AM_VMT_PC",
          "MD_VMT_PC",
          "PM_VMT_PC",
          "EV_VMT_PC",
          "DY_VMT_PC",
          "AM_VMT_LT",
          "MD_VMT_LT",
          "PM_VMT_LT",
          "EV_VMT_LT",
          "DY_VMT_LT",
          "AM_VMT_MD",
          "MD_VMT_MD",
          "PM_VMT_MD",
          "EV_VMT_MD",
          "DY_VMT_MD",
          "AM_VMT_HV",
          "MD_VMT_HV",
          "PM_VMT_HV",
          "EV_VMT_HV",
          "DY_VMT_HV",
          "FF_VHT",
          "AM_VHT",
          "MD_VHT",
          "PM_VHT",
          "EV_VHT",
          "DY_VHT",
          "AM_VHD",
          "MD_VHD",
          "PM_VHD",
          "EV_VHD",
          "DY_VHD"
        ],
        "sha256": "77f246d04a3c2a358922ea2bf697c65176c82791c331f0099d1d658e1fbc7560",
        "repo_path": "runs/shorten-lengthen-all-work-trips/Shift00/20260812-044057-56f4/outputs/Summary_SEGID_filtered.csv"
      },
      {
        "relative_path": "5_AssignHwy/4_Summaries/TAZ-Based Metrics.csv",
        "size_bytes": 35246665,
        "entry_type": "datafile",
        "columns": [
          "TAZID",
          "Metric",
          "Purpose",
          "Period",
          "PA",
          "Total"
        ],
        "sha256": "40e82db5e6a379484fe682b66bdfc9165ee1aac74a3353819569c172f73c477d",
        "repo_path": "runs/shorten-lengthen-all-work-trips/Shift00/20260812-044057-56f4/outputs/TAZ-Based Metrics_filtered.csv"
      },
      {
        "relative_path": "5_AssignHwy/5_FinalNetSkims/Skm_AM.mtx",
        "size_bytes": 37400982,
        "entry_type": "matrix",
        "tabs": [
          "GP_Dist"
        ],
        "format": "omx",
        "sha256": "d146e353df911e629d54291c6e2b4c950570ebc28b14e449b857c686734f7a86",
        "repo_path": "runs/shorten-lengthen-all-work-trips/Shift00/20260812-044057-56f4/outputs/Skm_AM.omx"
      },
      {
        "relative_path": "5_AssignHwy/5_FinalNetSkims/Skm_EV.mtx",
        "size_bytes": 37354676,
        "entry_type": "matrix",
        "tabs": [
          "GP_Dist"
        ],
        "format": "omx",
        "sha256": "719b40cbee871f942be7f45f20d15424632e97f3e2fb7b21e47d03f7f13baec8",
        "repo_path": "runs/shorten-lengthen-all-work-trips/Shift00/20260812-044057-56f4/outputs/Skm_EV.omx"
      },
      {
        "relative_path": "5_AssignHwy/5_FinalNetSkims/Skm_MD.mtx",
        "size_bytes": 37392572,
        "entry_type": "matrix",
        "tabs": [
          "GP_Dist"
        ],
        "format": "omx",
        "sha256": "0e8ae502d2a2e8d4a8e5442a8dcc86afdcdef050c9cc46aec3d83893cb28da95",
        "repo_path": "runs/shorten-lengthen-all-work-trips/Shift00/20260812-044057-56f4/outputs/Skm_MD.omx"
      },
      {
        "relative_path": "5_AssignHwy/5_FinalNetSkims/Skm_PM.mtx",
        "size_bytes": 37464790,
        "entry_type": "matrix",
        "tabs": [
          "GP_Dist"
        ],
        "format": "omx",
        "sha256": "25a8b61f818d1fcc9ec459fc6b8411c90e6a58c8f398e1302b585dbb1ad2f5f7",
        "repo_path": "runs/shorten-lengthen-all-work-trips/Shift00/20260812-044057-56f4/outputs/Skm_PM.omx"
      }
    ]
  },
  "error": null
}
